{
    "object": "consensus",
    "action": "elect",
    "instance_id": "0bknjMZT1rVyyHJbRQBGl0CjCIxUnSmZcnI1XNIdCpM=",
    "created_at": 1634553005,
    "key": {
        "type": "election",
        "id": "-t0xoQZa-ryiW18JnTjJHCsCNehFxuXOFOsfgKHHkj0=",
        "property": "state"
    },
    "value": "started"
}
